"Question Type: multiplechoice","Parent category","Category","Random answers","Correct feedback","Incorrect feedback","Points","Question","Correct","Answer A","Answer B","Answer C","Answer D","Answer E","Answer F","Answer G","Answer H","Answer I","Answer J"
"multiplechoice","HCGHS","Manipulacion y Emergencias","Yes","¡Correcto! El NFPA 704 es complementario al SGA-GHS, no un sustituto: su utilidad es la respuesta inmediata de bomberos en caso de incendio, identificando zonas o depositos completos.","Respuesta incorrecta. Revisa la seccion correspondiente en el material del curso HCGHS.","1","Conforme al material, el sistema NFPA 704 (Diamante de Riesgo) definido en NFPA 704:2022 se caracteriza, respecto al SGA-GHS, por ser:","D","Un sustituto que reemplaza al SGA-GHS","Un sistema mas antiguo ya derogado","Identico al SGA-GHS en todos sus aspectos","Complementario al SGA-GHS, no sustituto, de uso operativo para la respuesta inmediata de bomberos","","","","","",""
"multiplechoice","HCGHS","Manipulacion y Emergencias","Yes","¡Correcto! La regla rectora del almacenamiento es NUNCA mezclar incompatibles, ya que ciertas combinaciones producen reacciones violentas o gases toxicos.","Respuesta incorrecta. Revisa la seccion correspondiente en el material del curso HCGHS.","1","Segun el material, la regla rectora del almacenamiento compatible de productos quimicos es:","B","Almacenar todos los productos juntos para ahorrar espacio","Nunca mezclar productos incompatibles","Mezclar acidos con bases para neutralizarlos","Guardar los inflamables junto a los oxidantes","","","","","",""
"multiplechoice","HCGHS","Manipulacion y Emergencias","Yes","¡Correcto! Los acidos fuertes con bases fuertes, cianuros o sulfuros producen una reaccion exotermica violenta y liberan gases toxicos.","Respuesta incorrecta. Revisa la seccion correspondiente en el material del curso HCGHS.","1","De acuerdo con el material, los acidos fuertes NO se deben almacenar junto a bases fuertes, cianuros o sulfuros porque la reaccion produce:","C","Un cambio de color inofensivo","Una disminucion de la temperatura","Una reaccion exotermica violenta y gases toxicos","Una solidificacion del producto","","","","","",""
"multiplechoice","HCGHS","Manipulacion y Emergencias","Yes","¡Correcto! Los cianuros con acidos liberan HCN (cianuro de hidrogeno) gaseoso, que es letal.","Respuesta incorrecta. Revisa la seccion correspondiente en el material del curso HCGHS.","1","Segun el material, almacenar cianuros junto a acidos es peligroso porque provoca:","A","La liberacion de HCN (cianuro de hidrogeno) gaseoso letal","La solidificacion de ambos productos","Una reaccion sin ningun riesgo","La evaporacion segura del cianuro","","","","","",""
"multiplechoice","HCGHS","Manipulacion y Emergencias","Yes","¡Correcto! La separacion fisica debe ser mayor o igual a 6 metros, idealmente con muros corta-fuegos; si no es posible, se usan gabinetes de seguridad certificados.","Respuesta incorrecta. Revisa la seccion correspondiente en el material del curso HCGHS.","1","Conforme al material, la regla de separacion fisica minima recomendada entre productos incompatibles en el almacen es:","D","Menos de 1 metro","Exactamente 2 metros","No es necesaria ninguna separacion","Mayor o igual a 6 metros, idealmente con muros corta-fuegos","","","","","",""
"multiplechoice","HCGHS","Manipulacion y Emergencias","Yes","¡Correcto! Un derrame menor es de pequena magnitud y puede ser controlado con seguridad por personal capacitado con los medios del area, sin requerir equipos especializados ni evacuacion.","Respuesta incorrecta. Revisa la seccion correspondiente en el material del curso HCGHS.","1","Segun el material, un derrame quimico menor se define como aquel de pequena magnitud que:","B","Siempre requiere la evacuacion total de la planta","Puede ser controlado con seguridad por personal capacitado con los medios disponibles en el area, sin equipos especializados ni evacuacion","Solo puede atender un equipo externo de bomberos","Debe ignorarse hasta que llegue un supervisor","","","","","",""
"multiplechoice","HCGHS","Manipulacion y Emergencias","Yes","¡Correcto! Las reglas universales incluyen leer la etiqueta y la SDS antes de usar, usar EPP, no comer ni fumar en zonas con quimicos, no oler ni probar productos y no mezclar sin conocer su compatibilidad.","Respuesta incorrecta. Revisa la seccion correspondiente en el material del curso HCGHS.","1","De acuerdo con el material, entre las reglas universales de manipulacion segura de quimicos, que aplican a todo producto peligroso, se incluye:","C","Oler los productos para identificarlos","Comer y beber en zonas con quimicos","Leer la etiqueta y la SDS antes de usar, y no mezclar productos sin conocer su compatibilidad","Mantener los envases abiertos y sin etiqueta","","","","","",""
